260,260,084-14-000022,14-Aug-2014,30-Oct-2015,Construction of CC road from Venkataswamy house to Muniswamy house at Ramagondanahally in w no 84,084 Hagadur,Executive Engineer Mahadevapura - I Mahadevapura Zone,P1771 Zone Works - POW Works,M ANJINAPPA,8951120986,,First and Final,001/69,14-Aug-2014,000136,30-Oct-2015,000354,31-Dec-2015,006941,24-Oct-2017,000260 / 28-Oct-2017 in RTGS,764361,Seven Lakh Sixty Four Thousand Three Hundred Sixty One,96871,Ninety Six Thousand Eight Hundred Seventy One,667490,Six Lakh Sixty Seven Thousand Four Hundred Ninety 
261,261,084-13-000074,08-Aug-2014,31-Mar-2017,Improvements to road and drain at Immadihalli Village at Ward No84 ,084 Hagadur,Executive Engineer Mahadevapura - I Mahadevapura Zone,P0541 Commissioner Discretionary Grants,M/S KRIDL,9480828222,,Third and Final,000005,08-Aug-2014,000292,22-Mar-2017,000702,31-Mar-2017,005659,06-Sep-2018,000207 / 19-Sep-2018 in RTGS,3238400,Thirty Two Lakh Thirty Eight Thousand Four Hundred ,451422,Four Lakh Fifty One Thousand Four Hundred Twenty Two,2786978,Twenty Seven Lakh Eighty Six Thousand Nine Hundred Seventy Eight
262,262,084-13-000074,08-Aug-2014,30-Dec-2016,Improvements to road and drain at Immadihalli Village at Ward No84 ,084 Hagadur,Executive Engineer Mahadevapura - I Mahadevapura Zone,P0541 Commissioner Discretionary Grants,M/S KRIDL,9480828222,,Running,000005,08-Aug-2014,000207,30-Dec-2016,000501,30-Dec-2016,005655,06-Sep-2018,000207 / 19-Sep-2018 in RTGS,1715015,Seventeen Lakh Fifteen Thousand Fifteen,235195,Two Lakh Thirty Five Thousand One Hundred Ninety Five,1479820,Fourteen Lakh Seventy Nine Thousand Eight Hundred Twenty 
263,263,084-13-000076,08-Aug-2014,29-Feb-2016,Asphalting and Improvements to road and drain from Vijayanagara to Nagondanahalli road 305 m to 2305m at Ward No84 ,084 Hagadur,Executive Engineer Mahadevapura - I Mahadevapura Zone,P0541 Commissioner Discretionary Grants,The Technical Manager,9480828222,,Running,000003,08-Aug-2014,000173,29-Jan-2016,000426,29-Feb-2016,009587,06-Feb-2018,000402 / 22-Feb-2018 in RTGS,3489233,Thirty Four Lakh Eighty Nine Thousand Two Hundred Thirty Three,509545,Five Lakh Nine Thousand Five Hundred Fourty Five,2979688,Twenty Nine Lakh Seventy Nine Thousand Six Hundred Eighty Eight
264,264,084-13-000074,08-Aug-2014,30-Oct-2015,Improvements to road and drain at Immadihalli Village at Ward No84 ,084 Hagadur,Executive Engineer Mahadevapura - I Mahadevapura Zone,P0541 Commissioner Discretionary Grants,M/S KRIDL,9480828222,,Running,000005,08-Aug-2014,000127,30-Oct-2015,000267,31-Oct-2015,004066,20-Jul-2017,000151 / 22-Jul-2017 in RTGS,4829668,Fourty Eight Lakh Twenty Nine Thousand Six Hundred Sixty Eight,789064,Seven Lakh Eighty Nine Thousand Sixty Four,4040604,Fourty  Lakh Fourty  Thousand Six Hundred Four
265,265,084-13-000076,08-Aug-2014,31-Oct-2015,Asphalting and Improvements to road and drain from Vijayanagara to Nagondanahalli road 305 m to 2305m at Ward No84 ,084 Hagadur,Executive Engineer Mahadevapura - I Mahadevapura Zone,P0541 Commissioner Discretionary Grants,The Technical Manager,9480828222,,Running,000003,08-Aug-2014,000128,31-Oct-2015,000268,31-Oct-2015,003742,10-Jul-2017,000136 / 12-Jul-2017 in RTGS,8002272,Eighty  Lakh Two Thousand Two Hundred Seventy Two,1060092,Ten Lakh Sixty  Thousand Ninety Two,6942180,Sixty Nine Lakh Fourty Two Thousand One Hundred Eighty 
266,266,084-13-000081,08-Aug-2014,29-Dec-2014,Improvements to road and drain at Hagaduru Layout and Vinayakanagara  Village 2nd Stage at Ward o84,084 Hagadur,Executive Engineer Mahadevapura - I Mahadevapura Zone,P0541 Commissioner Discretionary Grants,M/s KRIDL,9480828222,,First and Final,010004,08-Aug-2014,000185,31-Dec-2014,000480,31-Jan-2015,007767,01-Mar-2017,000207 / 06-Mar-2017 in RTGS,9583948,Ninety Five Lakh Eighty Three Thousand Nine Hundred Fourty Eight,1281080,Twelve Lakh Eighty One Thousand Eighty ,8302868,Eighty Three Lakh Two Thousand Eight Hundred Sixty Eight
267,267,084-13-000073,08-Aug-2014,28-Nov-2014,Improvements to road and drain from Immadihalli to Valepura connecting road at Ward No84 ,084 Hagadur,Executive Engineer Mahadevapura - I Mahadevapura Zone,P0541 Commissioner Discretionary Grants,The Technical Manager,9480828222,,Running,000006,08-Aug-2014,000137,28-Nov-2014,000363,29-Nov-2014,006238,24-Dec-2016,000161 / 28-Dec-2016 in RTGS,10412684,One Crore Four Lakh Twelve Thousand Six Hundred Eighty Four,1534875,Fifteen Lakh Thirty Four Thousand Eight Hundred Seventy Five,8877809,Eighty Eight Lakh Seventy Seven Thousand Eight Hundred Nine
268,268,084-13-000076,08-Aug-2014,29-Nov-2014,Asphalting and Improvements to road and drain from Vijayanagara to Nagondanahalli road 305 m to 2305m at Ward No84 ,084 Hagadur,Executive Engineer Mahadevapura - I Mahadevapura Zone,P0541 Commissioner Discretionary Grants,The Technical Manager,9480828222,,Running,000003,08-Aug-2014,000152,29-Nov-2014,000384,29-Nov-2014,004539,10-Aug-2016,000100 / 17-Aug-2016 in RTGS,17783949,One Crore Seventy Seven Lakh Eighty Three Thousand Nine Hundred Fourty Nine,2617127,Twenty Six Lakh Seventeen Thousand One Hundred Twenty Seven,15166822,One Crore Fifty One Lakh Sixty Six Thousand Eight Hundred Twenty Two
269,269,084-14-000011,26-May-2014,31-Mar-2018,Improvements of road and drain from Narendra hosue to Narayanaswamy house in Immadihally at w no 84,084 Hagadur,Executive Engineer Mahadevapura - I Mahadevapura Zone,P1771 Zone Works - POW Works,P.Narayanaswamy,9448593413,,First and Final,000/15,24-May-2014,000043,27-Jul-2018,000096,27-Jul-2018,007812,20-Jan-2020,000359 / 21-Jan-2020 in RTGS,988418,Nine Lakh Eighty Eight Thousand Four Hundred Eighteen,108010,One Lakh Eight Thousand Ten,880408,Eight Lakh Eighty  Thousand Four Hundred Eight
270,270,084-14-000017,24-May-2014,10-Jan-2018,Construction of RCC drain from G M Narayanappa house to Raju house at Gandhipura in w no 84,084 Hagadur,Executive Engineer Mahadevapura - I Mahadevapura Zone,P1771 Zone Works - POW Works,P.Narayanaswamy,9448593413,,First and Final,000020,24-May-2014,000045,27-Jul-2018,000098,27-Jul-2018,007814,20-Jan-2020,000359 / 21-Jan-2020 in RTGS,982313,Nine Lakh Eighty Two Thousand Three Hundred Thirteen,108241,One Lakh Eight Thousand Two Hundred Fourty One,874072,Eight Lakh Seventy Four Thousand Seventy Two
271,271,084-14-000007,24-May-2014,30-Dec-2016,Improvments of road and construction of RCC drain in Akkalappa layout Immadihally at w no 84,084 Hagadur,Executive Engineer Mahadevapura - I Mahadevapura Zone,P1771 Zone Works - POW Works,P NARAYANASWAMY,9448593413,,Second and Final,000014,24-May-2014,00/210,30-Dec-2016,000498,30-Dec-2016,009890,21-Mar-2019,000384 / 25-Mar-2019 in RTGS,513705,Five Lakh Thirteen Thousand Seven Hundred Five,64047,Sixty Four Thousand Fourty Seven,449658,Four Lakh Fourty Nine Thousand Six Hundred Fifty Eight
272,272,084-14-000007,24-May-2014,30-Jun-2016,Improvments of road and construction of RCC drain in Akkalappa layout Immadihally at w no 84,084 Hagadur,Executive Engineer Mahadevapura - I Mahadevapura Zone,P1771 Zone Works - POW Works,P NARAYANASWAMY,9448593413,,Running,000014,24-May-2014,000079,30-Jun-2016,000171,30-Jun-2016,001963,26-May-2018,000067 / 31-May-2018 in RTGS,979656,Nine Lakh Seventy Nine Thousand Six Hundred Fifty Six,137701,One Lakh Thirty Seven Thousand Seven Hundred One,841955,Eight Lakh Fourty One Thousand Nine Hundred Fifty Five
273,273,084-14-000014,24-May-2014,30-May-2015,Construction of CC road to H N Somashekar house and next roads in Hagaduru Main road at w no 84,084 Hagadur,Executive Engineer Mahadevapura - I Mahadevapura Zone,P1771 Zone Works - POW Works,P NARAYANASWAMY,9740395643,,First and Final,000016,24-May-2014,000126,30-Oct-2015,000266,31-Oct-2015,003741,10-Jul-2017,000136 / 12-Jul-2017 in RTGS,997512,Nine Lakh Ninety Seven Thousand Five Hundred Twelve,123717,One Lakh Twenty Three Thousand Seven Hundred Seventeen,873795,Eight Lakh Seventy Three Thousand Seven Hundred Ninety Five
274,274,084-14-000010,24-May-2014,30-Sep-2015,Improvements of drain and road in Shanthi Avenue behind Post  office Whitefield at w no 84,084 Hagadur,Executive Engineer Mahadevapura - I Mahadevapura Zone,P1771 Zone Works - POW Works,P NARAYANASWAMY,9740395643,,First and Final,000018,24-May-2014,000101,28-Sep-2015,000214,30-Sep-2015,003260,19-Jun-2017,000117 / 23-Jun-2017 in RTGS,994047,Nine Lakh Ninety Four Thousand Fourty Seven,132065,One Lakh Thirty Two Thousand Sixty Five,861982,Eight Lakh Sixty One Thousand Nine Hundred Eighty Two
275,275,084-14-000008,24-May-2014,27-Jul-2015,Construction of RCC drain in Vinayaka layout roads and cross roads in w no 84,084 Hagadur,Executive Engineer Mahadevapura - I Mahadevapura Zone,P1771 Zone Works - POW Works,P NARAYANASWAMY,9740395643,,First and Final,001021,24-May-2014,000054,27-Jul-2015,000163,31-Aug-2015,003259,19-Jun-2017,000117 / 23-Jun-2017 in RTGS,1987627,Nineteen Lakh Eighty Seven Thousand Six Hundred Twenty Seven,265400,Two Lakh Sixty Five Thousand Four Hundred ,1722227,Seventeen Lakh Twenty Two Thousand Two Hundred Twenty Seven
276,276,084-14-000009,24-May-2014,27-Jul-2015,Construction of RCC drain in Byrappa layout roads and cross roads in w no 84,084 Hagadur,Executive Engineer Mahadevapura - I Mahadevapura Zone,P1771 Zone Works - POW Works,P NARAYANASWAMY,9740395643,,First and Final,001019,24-May-2014,000052,27-Jul-2015,000162,31-Aug-2015,003258,19-Jun-2017,000117 / 23-Jun-2017 in RTGS,995613,Nine Lakh Ninety Five Thousand Six Hundred Thirteen,136095,One Lakh Thirty Six Thousand Ninety Five,859518,Eight Lakh Fifty Nine Thousand Five Hundred Eighteen
277,277,084-14-000012,24-May-2014,28-Nov-2014,Improvements of drain in Karumariyamma temple road upto Chowdappa house in Whitefield w no 84,084 Hagadur,Executive Engineer Mahadevapura - I Mahadevapura Zone,P1771 Zone Works - POW Works,P Narayanaswamy,9740395643,,First and Final,000017,24-May-2014,000153,29-Nov-2014,000385,29-Nov-2014,008452,25-Mar-2017,000226 / 28-Mar-2017 in RTGS,1494199,Fourteen Lakh Ninety Four Thousand One Hundred Ninety Nine,192040,One Lakh Ninety Two Thousand Fourty ,1302159,Thirteen Lakh Two Thousand One Hundred Fifty Nine
278,278,084-14-000001,24-May-2014,29-Jun-2014,Sinking of borewell at Gandhipura Hagaduru Colony Nagondanahally in Ward No 84 Hagaduru  3 Nos,084 Hagadur,Executive Engineer Mahadevapura - I Mahadevapura Zone,P1802 Water Supply New Areas,P.Narayanaswamy,9448593413,,First and Final,000023,24-May-2014,000071,30-Jun-2014,000159,30-Jun-2014,002232,19-Aug-2015,000612 / 20-Aug-2015 in RTGS,1659900,Sixteen Lakh Fifty Nine Thousand Nine Hundred ,184750,One Lakh Eighty Four Thousand Seven Hundred Fifty ,1475150,Fourteen Lakh Seventy Five Thousand One Hundred Fifty 
279,279,084-14-000002,24-May-2014,30-Jun-2014,Sinking of borewell at Ramgondanahally and Siddapura in Ward No 84 Hagaduru  2 Nos  ,084 Hagadur,Executive Engineer Mahadevapura - I Mahadevapura Zone,P1802 Water Supply New Areas,P.Narayanaswamy,9448593413,,First and Final,000022,24-May-2014,000073,30-Jun-2014,000160,30-Jun-2014,004297,23-Dec-2015,001811 / 02-Jan-2016 in RTGS,1099942,Ten Lakh Ninety Nine Thousand Nine Hundred Fourty Two,122422,One Lakh Twenty Two Thousand Four Hundred Twenty Two,977520,Nine Lakh Seventy Seven Thousand Five Hundred Twenty 
280,280,084-13-000058,13-Jan-2014,29-Jan-2015,Providing and Laying Asphalting to Varthur kodi cross road in Hagaduru Ward No  84  ,084 Hagadur,Executive Engineer Mahadevapura - I Mahadevapura Zone,P2201 Assembly Constituency Development Works under BBMP,KRIDL,7829305102,,First and Final,100198,01-Apr-2014,000236,30-Jan-2015,000548,31-Jan-2015,,           ,Under Process in EE (Acts. Supdt.),598500,Five Lakh Ninety Eight Thousand Five Hundred ,82095,Eighty Two Thousand Ninety Five,516405,Five Lakh Sixteen Thousand Four Hundred Five
281,281,084-13-000032,04-Mar-2014,20-Jan-2015,Providing GI Pipeline & cable wires to existing borewells in ward no.84,084 Hagadur,Executive Engineer Mahadevapura - I Mahadevapura Zone,P1771 Zone Works - POW Works,M Anjinappa,8951120986,,First and Final,000290,04-Mar-2014,000087,22-Sep-2015,000216,30-Sep-2015,003048,14-Jun-2017,000100 / 14-Jun-2017 in RTGS,98475,Ninety Eight Thousand Four Hundred Seventy Five,12255,Twelve Thousand Two Hundred Fifty Five,86220,Eighty Six Thousand Two Hundred Twenty 
282,282,084-13-000032,04-Mar-2014,26-Aug-2014,Repair and Maintenance of Submersible pump and motors panel boards in cluding unused parts at w.no.84,084 Hagadur,Executive Engineer Mahadevapura - I Mahadevapura Zone,P1771 Zone Works - POW Works,H.M.Mahendra,9945536393,,Running,000292,04-Mar-2014,000102,30-Aug-2014,000269,30-Aug-2014,,           ,000028 / 11-May-2021 in RTGS,398841,Three Lakh Ninety Eight Thousand Eight Hundred Fourty One,47479,Fourty Seven Thousand Four Hundred Seventy Nine,351362,Three Lakh Fifty One Thousand Three Hundred Sixty Two
283,283,084-13-000032,04-Mar-2014,15-Jul-2014,Providing and laying PVC Pipe line for damaged portions in Ramagondanahally village limit ward no.84  ,084 Hagadur,Executive Engineer Mahadevapura - I Mahadevapura Zone,P1771 Zone Works - POW Works,M.Anjinappa,8951120986,,Running,000286,04-Mar-2014,000093,30-Jul-2014,000239,31-Jul-2014,002225,19-Aug-2015,000626 / 20-Aug-2015 in RTGS,98310,Ninety Eight Thousand Three Hundred Ten,11470,Eleven Thousand Four Hundred Seventy ,86840,Eighty Six Thousand Eight Hundred Fourty 
284,284,084-13-000032,04-Mar-2014,15-Mar-2014,Fund Earmarked for emergency works at Hagaduru Ward No84  ,084 Hagadur,Executive Engineer Mahadevapura - I Mahadevapura Zone,P1771 Zone Works - POW Works,M.Anjinappa,8951120986,,First and Final,000289,04-Mar-2014,000094,30-Jul-2014,000238,31-Jul-2014,004312,24-Dec-2015,001817 / 02-Jan-2016 in RTGS,146700,One Lakh Fourty Six Thousand Seven Hundred ,16850,Sixteen Thousand Eight Hundred Fifty ,129850,One Lakh Twenty Nine Thousand Eight Hundred Fifty 
285,285,084-13-000032,04-Mar-2014,30-Jul-2014,Fund Earmarked for emergency works at Hagaduru Ward No84  ,084 Hagadur,Executive Engineer Mahadevapura - I Mahadevapura Zone,P1771 Zone Works - POW Works,H M Mahendra,9945537393,,Running,000291,04-Mar-2014,000095,30-Jul-2014,000236,31-Jul-2014,,           ,000028 / 11-May-2021 in RTGS,99904,Ninety Nine Thousand Nine Hundred Four,11896,Eleven Thousand Eight Hundred Ninety Six,88008,Eighty Eight Thousand Eight
286,286,084-12-000051,04-Mar-2014,28-May-2014,Providing and laying PVC Pipe line and gate valves at Sai Layout in w.no.84,084 Hagadur,Executive Engineer Mahadevapura - I Mahadevapura Zone,P1771 Zone Works - POW Works,M.Anjinappa,8951120986,,Running,000294,04-Mar-2014,000029,29-May-2014,000076,31-May-2014,002221,19-Aug-2015,000626 / 20-Aug-2015 in RTGS,95938,Ninety Five Thousand Nine Hundred Thirty Eight,10690,Ten Thousand Six Hundred Ninety ,85248,Eighty Five Thousand Two Hundred Fourty Eight
287,287,084-12-000051,04-Mar-2014,28-May-2014,Providing and laying PVC Pipe line and gate valves at Whitefield area in w.no.84,084 Hagadur,Executive Engineer Mahadevapura - I Mahadevapura Zone,P1771 Zone Works - POW Works,M.Anjinappa,8951120986,,Running,000293,04-Mar-2014,000025,29-May-2014,000077,31-May-2014,002219,19-Aug-2015,000626 / 20-Aug-2015 in RTGS,97113,Ninety Seven Thousand One Hundred Thirteen,10830,Ten Thousand Eight Hundred Thirty ,86283,Eighty Six Thousand Two Hundred Eighty Three
288,288,084-12-000051,04-Mar-2014,30-May-2014,Providing and laying PVC Pipe line and gate valves at Hagaduru ward area in w.no.84,084 Hagadur,Executive Engineer Mahadevapura - I Mahadevapura Zone,P1771 Zone Works - POW Works,M.Anjinappa,8951120986,,Running,000295,04-Mar-2014,000028,29-May-2014,000075,31-May-2014,002218,19-Aug-2015,000626 / 20-Aug-2015 in RTGS,94720,Ninety Four Thousand Seven Hundred Twenty ,10556,Ten Thousand Five Hundred Fifty Six,84164,Eighty Four Thousand One Hundred Sixty Four
289,289,084-13-000032,04-Mar-2014,29-May-2014,Providing & laying PVC pipe line from Nellurahalli circle to Pugasattepalya in w.no.84 ,084 Hagadur,Executive Engineer Mahadevapura - I Mahadevapura Zone,P1771 Zone Works - POW Works,M.Anjinappa,8951120986,,Running,000288,04-Mar-2014,000026,29-May-2014,000073,31-May-2014,006072,02-Mar-2016,000005 / 07-Apr-2016 in RTGS,245843,Two Lakh Fourty Five Thousand Eight Hundred Fourty Three,27390,Twenty Seven Thousand Three Hundred Ninety ,218453,Two Lakh Eighteen Thousand Four Hundred Fifty Three
290,290,084-13-000032,04-Mar-2014,29-May-2014,"Maintenance and repairs of existing Pipelines and Gate valves at Ganhdipura, Vijayanagara, Nagondanahally and Immadihally in w.no.84",084 Hagadur,Executive Engineer Mahadevapura - I Mahadevapura Zone,P1771 Zone Works - POW Works,H.M.Mahendra,9945536393,,Running,000287,04-Mar-2014,000027,29-May-2014,000074,31-May-2014,,           ,000028 / 11-May-2021 in RTGS,149329,One Lakh Fourty Nine Thousand Three Hundred Twenty Nine,17036,Seventeen Thousand Thirty Six,132293,One Lakh Thirty Two Thousand Two Hundred Ninety Three
291,291,084-13-000032,04-Mar-2014,30-Jul-2014,"Maintenance and repairs of existing Pipelines and Gate valves at Ganhdipura, Vijayanagara, Nagondanahally and Immadihally in w.no.84",084 Hagadur,Executive Engineer Mahadevapura - I Mahadevapura Zone,P1771 Zone Works - POW Works,H.M.Mahendra,9945536393,,Running,000287,04-Mar-2014,000103,30-Aug-2014,,           ,,           ,Under Process in Executive Engineer,99904,Ninety Nine Thousand Nine Hundred Four,0,,0,
292,292,084-14-000004,03-Mar-2014,20-Jul-2014,Maintenance and  replacement of damaged cable  wires and  errection of extra Gi Pipes and Panel board accessories in Hagaduru Ward No 84    ,084 Hagadur,Executive Engineer Mahadevapura - I Mahadevapura Zone,P1802 Water Supply New Areas,P.Narayanaswamy,9448593413,,First and Final,000263,03-Mar-2014,000084,30-Jul-2014,000261,27-Aug-2014,006073,02-Mar-2016,000005 / 07-Apr-2016 in RTGS,574653,Five Lakh Seventy Four Thousand Six Hundred Fifty Three,65980,Sixty Five Thousand Nine Hundred Eighty ,508673,Five Lakh Eight Thousand Six Hundred Seventy Three
293,293,084-14-000003,03-Mar-2014,29-Jun-2014,Maintenance and repairs to pump and motors panel boards in Hagaduru Ward No 84  ,084 Hagadur,Executive Engineer Mahadevapura - I Mahadevapura Zone,P1802 Water Supply New Areas,P.Narayanaswamy,9448593413,,First and Final,000262,03-Mar-2014,000070,30-Jun-2014,000161,30-Jun-2014,006074,02-Mar-2016,000005 / 07-Apr-2016 in RTGS,759976,Seven Lakh Fifty Nine Thousand Nine Hundred Seventy Six,85086,Eighty Five Thousand Eighty Six,674890,Six Lakh Seventy Four Thousand Eight Hundred Ninety 
294,294,084-14-000005,03-Mar-2014,03-Jun-2014,Providing and Supplying Pump and motors and accessories to Hagaduru Ward No 84  ,084 Hagadur,Executive Engineer Mahadevapura - I Mahadevapura Zone,P1802 Water Supply New Areas,P Narayanaswamy,9740395643,,First and Final,010026,03-Mar-2014,000072,30-Jun-2014,000162,30-Jun-2014,002021,06-Jun-2016,000052 / 13-Jun-2016 in RTGS,560017,Five Lakh Sixty  Thousand Seventeen,62330,Sixty Two Thousand Three Hundred Thirty ,497687,Four Lakh Ninety Seven Thousand Six Hundred Eighty Seven
295,295,084-14-000029,28-Feb-2014,29-Nov-2014,Removing resetting of Slabs and desilting of drains in Outer circle road Whitefield at w no 84,084 Hagadur,Executive Engineer Mahadevapura - I Mahadevapura Zone,P1771 Zone Works - POW Works,G M NARAYANAPPA,9900099945,,First and Final,000258,28-Feb-2014,000190,29-Jan-2015,000387,01-Jan-2015,,           ,000028 / 11-May-2021 in RTGS,473357,Four Lakh Seventy Three Thousand Three Hundred Fifty Seven,57970,Fifty Seven Thousand Nine Hundred Seventy ,415387,Four Lakh Fifteen Thousand Three Hundred Eighty Seven
296,296,084-12-000051,23-Jan-2014,29-Apr-2014,Improvements and Electrification to Existing Anganavadi buildings at Hagaduru w.no.84,084 Hagadur,Executive Engineer Mahadevapura - I Mahadevapura Zone,P1771 Zone Works - POW Works,V CHINNAPPA,9448518338,,Running,010207,23-Jan-2014,000021,29-May-2014,000063,29-May-2014,001095,16-May-2016,000031 / 20-May-2016 in RTGS,199303,One Lakh Ninety Nine Thousand Three Hundred Three,24730,Twenty Four Thousand Seven Hundred Thirty ,174573,One Lakh Seventy Four Thousand Five Hundred Seventy Three
297,297,084-14-000024,13-Jan-2014,13-Oct-2015,Supply of new pump  motor  Panel board and cable for Emergency purpose for water supply borewells in w no 84,084 Hagadur,Executive Engineer Mahadevapura - I Mahadevapura Zone,P1771 Zone Works - POW Works,Sri Thirumala Eectricals,9845194409,,First and Final,000199,13-Jan-2014,000125,30-Oct-2015,000258,31-Oct-2015,006396,22-Mar-2016,000005 / 07-Apr-2016 in RTGS,956240,Nine Lakh Fifty Six Thousand Two Hundred Fourty ,106930,One Lakh Six Thousand Nine Hundred Thirty ,849310,Eight Lakh Fourty Nine Thousand Three Hundred Ten
298,298,084-13-000028,13-Jan-2014,29-Jan-2015,"Desilting of drains, removing of debris burms cutting works in Ward no 84 area  ",084 Hagadur,Executive Engineer Mahadevapura - I Mahadevapura Zone,P1771 Zone Works - POW Works,M ANJINAPPA,8951120986,,First and Final,000198,13-Jan-2014,000259,01-Jan-2015,000536,01-Jan-2015,,           ,000028 / 11-May-2021 in RTGS,445851,Four Lakh Fourty Five Thousand Eight Hundred Fifty One,54036,Fifty Four Thousand Thirty Six,391815,Three Lakh Ninety One Thousand Eight Hundred Fifteen
299,299,084-14-000031,02-Jan-2014,29-Jan-2015,Maintenance and repair works of Pipe lines and Gate valves at w no 84 area,084 Hagadur,Executive Engineer Mahadevapura - I Mahadevapura Zone,P1771 Zone Works - POW Works,H M Mahendra,7829305102,,First and Final,000189,02-Jan-2014,000260,31-Jan-2015,000537,31-Jan-2015,,           ,000028 / 11-May-2021 in RTGS,968515,Nine Lakh Sixty Eight Thousand Five Hundred Fifteen,115410,One Lakh Fifteen Thousand Four Hundred Ten,853105,Eight Lakh Fifty Three Thousand One Hundred Five
300,300,084-14-000027,02-Jan-2014,30-Sep-2014,Engaging of Tractor and Gangmens for Silt removing in drains at w no 84 area,084 Hagadur,Executive Engineer Mahadevapura - I Mahadevapura Zone,P1771 Zone Works - POW Works,H M Mahendra,9945536393,,First and Final,000187,02-Jan-2014,000128,30-Oct-2014,000361,29-Nov-2014,,           ,000028 / 11-May-2021 in RTGS,965463,Nine Lakh Sixty Five Thousand Four Hundred Sixty Three,110100,One Lakh Ten Thousand One Hundred ,855363,Eight Lakh Fifty Five Thousand Three Hundred Sixty Three
301,301,084-13-000065,02-Jan-2014,02-Jan-2014,Sinking of Borewell and Providing Submersible Pumpset and  Pipeline at Gandhipura Village in Ward No 84 Hagadur  2 Nos   ,084 Hagadur,Executive Engineer Mahadevapura - I Mahadevapura Zone,P2654 Special Package for 110 Villages (Rs. 1 Crore Per Village),H M MAHENDRA ,9945536393,,First and Final,000182,02-Jan-2014,010103,30-Aug-2014,000270,30-Aug-2014,,           ,000070 / 10-Jun-2021 in RTGS,685315,Six Lakh Eighty Five Thousand Three Hundred Fifteen,79549,Seventy Nine Thousand Five Hundred Fourty Nine,605766,Six Lakh Five Thousand Seven Hundred Sixty Six
302,302,084-13-000031,02-Jan-2014,15-Jul-2014,Maintenance and repair works of Pipeline and other works at Immadihalli Nagondanahalli Gandhipura and Vijayanagara in ward no 84  ,084 Hagadur,Executive Engineer Mahadevapura - I Mahadevapura Zone,P1771 Zone Works - POW Works,H.M.Mahendra,9945536393,,First and Final,010181,02-Jan-2014,000092,30-Jul-2014,000240,31-Jul-2014,,           ,000028 / 11-May-2021 in RTGS,701123,Seven Lakh One Thousand One Hundred Twenty Three,84974,Eighty Four Thousand Nine Hundred Seventy Four,616149,Six Lakh Sixteen Thousand One Hundred Fourty Nine
303,303,084-13-000061,02-Jan-2014,14-Jul-2014,Sinking of Borewell and Providing Submersible Pumpset and  Pipeline at Nagonadanahalli Village in Ward No 84 Hagadur  ,084 Hagadur,Executive Engineer Mahadevapura - I Mahadevapura Zone,P2654 Special Package for 110 Villages (Rs. 1 Crore Per Village),H.M.Mahendra,9739957937,,Running,000186,02-Jan-2014,000091,30-Jul-2014,000237,31-Jul-2014,,           ,000028 / 11-May-2021 in RTGS,406885,Four Lakh Six Thousand Eight Hundred Eighty Five,48395,Fourty Eight Thousand Three Hundred Ninety Five,358490,Three Lakh Fifty Eight Thousand Four Hundred Ninety 
304,304,084-13-000062,02-Jan-2014,28-May-2014,Sinking of Borewell and Providing Submersible Pumpset and  Pipeline at Siddapura Village in Ward No 84 Hagadur   ,084 Hagadur,Executive Engineer Mahadevapura - I Mahadevapura Zone,P2654 Special Package for 110 Villages (Rs. 1 Crore Per Village),H M Mahendra,9945536393,,First and Final,000185,02-Jan-2014,000032,29-May-2014,000071,31-May-2014,,           ,000028 / 11-May-2021 in RTGS,503050,Five Lakh Three Thousand Fifty ,57720,Fifty Seven Thousand Seven Hundred Twenty ,445330,Four Lakh Fourty Five Thousand Three Hundred Thirty 
305,305,084-13-000063,02-Jan-2014,29-May-2014,Sinking of Borewell and Providing Submersible Pumpset and  Pipeline at Ramgonadanahalli Village in Ward No 84 Hagadur   ,084 Hagadur,Executive Engineer Mahadevapura - I Mahadevapura Zone,P2654 Special Package for 110 Villages (Rs. 1 Crore Per Village),H.M.Mahendra,9945536393,,Final,000184,02-Jan-2014,000030,29-May-2014,000072,31-May-2014,,           ,000028 / 11-May-2021 in RTGS,561911,Five Lakh Sixty One Thousand Nine Hundred Eleven,64360,Sixty Four Thousand Three Hundred Sixty ,497551,Four Lakh Ninety Seven Thousand Five Hundred Fifty One
306,306,084-13-000069,02-Jan-2014,31-Jul-2014,Providing Additional Street lights in Hagadur ward No.84,084 Hagadur,Executive Engineer Electrical Mahadevapura Zone,P1828 Provision of Additional Fittings Streetlights,Keerthi Electricalas,9845046438,,First and Final,000015,01-Jan-2014,000067,31-Jul-2014,000055,07-Aug-2014,002880,20-Jun-2016,000067 / 23-Jun-2016 in RTGS,161544,One Lakh Sixty One Thousand Five Hundred Fourty Four,18283,Eighteen Thousand Two Hundred Eighty Three,143261,One Lakh Fourty Three Thousand Two Hundred Sixty One
