156,156,104-17-000004,22-Sep-2016,30-Jun-2017,Improvements to drain at 17th cross of MC layout and water tank surroundings area in ward no 104 Govindarajanagar,104 Govindaraja Nagar,Executive Engineer Govindaraja Nagar West Zone,P0190 Works sanctioned by Hon Mayor,Technical Manger West KRIDL,9900000000,,First and Final,000051,22-Sep-2016,000113,03-Jan-2018,000110,03-Jan-2018,008930,24-Jan-2019,000343 / 07-Feb-2019 in RTGS,3477628,Thirty Four Lakh Seventy Seven Thousand Six Hundred Twenty Eight,977628,Nine Lakh Seventy Seven Thousand Six Hundred Twenty Eight,2500000,Twenty Five Lakh 
157,157,104-17-000007,22-Sep-2016,30-May-2017,Balance work of construction of Library building at bule park in ward no 104 Govindarajanagar,104 Govindaraja Nagar,Executive Engineer Govindaraja Nagar West Zone,P0190 Works sanctioned by Hon Mayor,Technical Manager West KRIDL,9900000000,,First and Final,000054,22-Sep-2016,000065,30-Jun-2017,000184,30-Jun-2017,003088,29-Jun-2018,000107 / 02-Jul-2018 in RTGS,886298,Eight Lakh Eighty Six Thousand Two Hundred Ninety Eight,115683,One Lakh Fifteen Thousand Six Hundred Eighty Three,770615,Seven Lakh Seventy  Thousand Six Hundred Fifteen
158,158,104-17-000003,22-Sep-2016,28-Apr-2017,Providing cement concrete and Improvements to drain at 4th main road Govindarajanagar and surrounding area in ward no 104 Govindarajanagar,104 Govindaraja Nagar,Executive Engineer Govindaraja Nagar West Zone,P0190 Works sanctioned by Hon Mayor,Technical Manager West KRIDL,9900000000,,First and Final,000050,22-Sep-2016,00008A,28-Apr-2017,000041,28-Apr-2017,006040,01-Oct-2018,000230 / 12-Oct-2018 in RTGS,4672233,Fourty Six Lakh Seventy Two Thousand Two Hundred Thirty Three,651283,Six Lakh Fifty One Thousand Two Hundred Eighty Three,4020950,Fourty  Lakh Twenty  Thousand Nine Hundred Fifty 
159,159,104-17-000005,22-Sep-2016,07-Mar-2017,Formation of footpath and Improvements to drain at 6th main road of M C Layout (Syndicate Bank Road) in ward no 104 Govindarajanagar,104 Govindaraja Nagar,Executive Engineer Govindaraja Nagar West Zone,P0190 Works sanctioned by Hon Mayor,Technical Manager West KRIDL,9900000000,,First and Final,000052,22-Sep-2016,000160,28-Mar-2017,000876,31-Mar-2017,005455,28-Aug-2018,000193 / 03-Sep-2018 in RTGS,3687106,Thirty Six Lakh Eighty Seven Thousand One Hundred Six,524078,Five Lakh Twenty Four Thousand Seventy Eight,3163028,Thirty One Lakh Sixty Three Thousand Twenty Eight
160,160,104-17-000002,22-Sep-2016,31-Jan-2017,Reconstruction of culverts and Regrading of drains at 5th 6th 7th 10th 10th A cross and 1st A B main Roads of Prashanth Nagar in ward no 104 Govindarajanagar,104 Govindaraja Nagar,Executive Engineer Govindaraja Nagar West Zone,P0190 Works sanctioned by Hon Mayor,Technical Manger West KRIDL,9900000000,,First and Final,000048,22-Sep-2016,000113,31-Jan-2017,000717,31-Jan-2017,004529,28-Jul-2018,000152 / 03-Aug-2018 in RTGS,4491939,Fourty Four Lakh Ninety One Thousand Nine Hundred Thirty Nine,635169,Six Lakh Thirty Five Thousand One Hundred Sixty Nine,3856770,Thirty Eight Lakh Fifty Six Thousand Seven Hundred Seventy 
161,161,104-17-000008,22-Sep-2016,18-Jan-2017,Formation of footpath and Improvements to drain 8th cross and 9th cross prashanth nagar in ward no 104,104 Govindaraja Nagar,Executive Engineer Govindaraja Nagar West Zone,P0190 Works sanctioned by Hon Mayor,Technical Manager West KRIDL,9900000000,,First and Final,000053,22-Sep-2016,000123,31-Jan-2017,000731,31-Jan-2017,004547,28-Jul-2018,000152 / 03-Aug-2018 in RTGS,4946620,Fourty Nine Lakh Fourty Six Thousand Six Hundred Twenty ,683315,Six Lakh Eighty Three Thousand Three Hundred Fifteen,4263305,Fourty Two Lakh Sixty Three Thousand Three Hundred Five
162,162,104-17-000016,14-Sep-2016,08-Dec-2016,Providing and fixing pargola and dustbin to kabadi ground park and prashanthi vana park in  Ward no-104 Govindrajnagar,104 Govindaraja Nagar,Executive Engineer SWM 1 Central Zone,P0311 Landscape Development Of Parks/Medians/Boulevants and Circles(Janoodya Works),"Executive Engineer-2, KRIDL",8496023544,,First and Final,000019,14-Sep-2016,000155,30-Jan-2017,000010,07-Apr-2017,003061,27-Jun-2018,000108 / 02-Jul-2018 in RTGS,667930,Six Lakh Sixty Seven Thousand Nine Hundred Thirty ,73471,Seventy Three Thousand Four Hundred Seventy One,594459,Five Lakh Ninety Four Thousand Four Hundred Fifty Nine
163,163,104-17-000017,15-Sep-2016,05-Dec-2016,Development of works at kabbadi ground park in  Ward no-104 Govindrajnagar,104 Govindaraja Nagar,Executive Engineer SWM 1 Central Zone,P0311 Landscape Development Of Parks/Medians/Boulevants and Circles(Janoodya Works),"Executive Engineer-2, KRIDL",8496023544,,First and Final,000017,14-Sep-2016,000156,30-Jan-2017,000011,07-Apr-2017,003062,27-Jun-2018,000108 / 02-Jul-2018 in RTGS,1108515,Eleven Lakh Eight Thousand Five Hundred Fifteen,138315,One Lakh Thirty Eight Thousand Three Hundred Fifteen,970200,Nine Lakh Seventy  Thousand Two Hundred 
164,164,104-17-000019,14-Sep-2016,08-Dec-2016,Improvements of shree krishna park at Thimmenahali in  Ward no-104 Govindrajnagar,104 Govindaraja Nagar,Executive Engineer Project West Zone,P0311 Landscape Development Of Parks/Medians/Boulevants and Circles(Janoodya Works),The Executive Engineer 2	,9449863064,,First and Final,000*18,14-Sep-2016,000161,20-Mar-2017,000009,07-Apr-2017,003060,27-Jun-2018,000108 / 02-Jul-2018 in RTGS,838898,Eight Lakh Thirty Eight Thousand Eight Hundred Ninety Eight,102855,One Lakh Two Thousand Eight Hundred Fifty Five,736043,Seven Lakh Thirty Six Thousand Fourty Three
165,165,104-15-000012,08-Aug-2016,30-Jun-2017,Providing Asphalting to Main and Cross Roads Of Prashanth nagara in ward No. 104   ,104 Govindaraja Nagar,Executive Engineer Govindaraja Nagar West Zone,P1771 Zone Works - POW Works,M S Venkatesh,9886066040,,First and Final,000o29,08-Aug-2016,000062,30-Jun-2017,000180,30-Jun-2017,003680,18-Jul-2019,000122 / 23-Jul-2019 in RTGS,8236326,Eighty Two Lakh Thirty Six Thousand Three Hundred Twenty Six,546026,Five Lakh Fourty Six Thousand Twenty Six,7690300,Seventy Six Lakh Ninety  Thousand Three Hundred 
166,166,104-16-000006,01-Jun-2016,22-Dec-2016,Providing LED Street Lights in Govindarajangara Ward No.104,104 Govindaraja Nagar,Executive Engineer Electrical West Zone,P1771 Zone Works - POW Works,Sree Mamatha Electrical Enterprises,8723234287,,Final,000005,01-Jun-2016,000091,06-Apr-2017,000196,22-Dec-2016,000407,07-Apr-2018,000010 / 10-Apr-2018 in RTGS,706504,Seven Lakh Six Thousand Five Hundred Four,91710,Ninety One Thousand Seven Hundred Ten,614794,Six Lakh Fourteen Thousand Seven Hundred Ninety Four
167,167,104-16-000008,29-Mar-2016,29-Jun-2016,providing RCC box drain and BS slab covering (Balance Portion) at Alidas Layout Mainroad in ward No. 104 Govindarajnagar,104 Govindaraja Nagar,Executive Engineer Govindaraja Nagar West Zone,P1771 Zone Works - POW Works,R Chandrashekar M/s S P Enterprises,8496023544,,First and Final,000106,29-Mar-2016,000047,30-Jun-2016,000311,30-Jun-2016,010236,02-Mar-2018,000418 / 12-Mar-2018 in RTGS,448261,Four Lakh Fourty Eight Thousand Two Hundred Sixty One,52077,Fifty Two Thousand Seventy Seven,396184,Three Lakh Ninety Six Thousand One Hundred Eighty Four
168,168,104-16-000003,22-Jun-2017,29-Jun-2016,Improvements to footpath and Reconstruction of drain at 8th cross (western side) of MRCR Layout in ward no.104,104 Govindaraja Nagar,Executive Engineer Govindaraja Nagar West Zone,P1771 Zone Works - POW Works,J Anand,9448505071,,First and Final,000089,18-Mar-2016,000045,30-Jun-2016,000290,30-Jun-2016,010503,15-Mar-2018,000440 / 27-Mar-2018 in RTGS,2302200,Twenty Three Lakh Two Thousand Two Hundred ,290407,Two Lakh Ninety  Thousand Four Hundred Seven,2011793,Twenty  Lakh Eleven Thousand Seven Hundred Ninety Three
169,169,104-15-000023,16-Mar-2016,29-Mar-2016,Providing lighting system to CA Site childrens park between 23rd and 24th cross corporation colony Govindarajanagara ward no 104  ,104 Govindaraja Nagar,Executive Engineer Electrical West Zone,P2415 Reserve fund for TandF Committee,The Technical Manager 2,9845756388,,Final,O00015,16-Mar-2016,000135,27-Nov-2016,000238,31-Mar-2016,007239,31-Oct-2017,000277 / 08-Nov-2017 in RTGS,305536,Three Lakh Five Thousand Five Hundred Thirty Six,45528,Fourty Five Thousand Five Hundred Twenty Eight,260008,Two Lakh Sixty  Thousand Eight
170,170,104-16-000002,04-Mar-2016,30-Nov-2016,Engaging Private Labours for ward Maintenance for the year 2015-16 in ward No.104,104 Govindaraja Nagar,Executive Engineer Govindaraja Nagar West Zone,P1771 Zone Works - POW Works,H Narsegowda,7899324448,,Third and Final,000067,04-Mar-2016,000106,31-Dec-2016,000723,31-Jan-2017,001333,09-May-2018,000048 / 10-May-2018 in RTGS,151289,One Lakh Fifty One Thousand Two Hundred Eighty Nine,16840,Sixteen Thousand Eight Hundred Fourty ,134449,One Lakh Thirty Four Thousand Four Hundred Fourty Nine
171,171,104-16-000002,04-Mar-2016,19-Sep-2016,Engaging Private Labours for ward Maintenance for the year 2015-16 in ward No.104,104 Govindaraja Nagar,Executive Engineer Govindaraja Nagar West Zone,P1771 Zone Works - POW Works,H Narsegowda,7899324448,,Running,000067,04-Mar-2016,000074,19-Sep-2016,000539,19-Sep-2016,005061,23-Aug-2017,000195 / 23-Aug-2017 in RTGS,288521,Two Lakh Eighty Eight Thousand Five Hundred Twenty One,32084,Thirty Two Thousand Eighty Four,256437,Two Lakh Fifty Six Thousand Four Hundred Thirty Seven
172,172,104-16-000002,04-Mar-2016,30-Jun-2016,Engaging Private Labours for ward Maintenance for the year 2015-16 in ward No.104,104 Govindaraja Nagar,Executive Engineer Govindaraja Nagar West Zone,P1771 Zone Works - POW Works,H Narsegowda,7899324448,,Running,000067,04-Mar-2016,000042,30-Jun-2016,000267,30-Jun-2016,000655,24-Apr-2017,000034 / 27-Apr-2017 in RTGS,339207,Three Lakh Thirty Nine Thousand Two Hundred Seven,37711,Thirty Seven Thousand Seven Hundred Eleven,301496,Three Lakh One Thousand Four Hundred Ninety Six
173,173,104-16-000002,           ,           ,Engaging Private Labours for ward Maintenance for the year 2015-16 in ward No.104,104 Govindaraja Nagar,Executive Engineer Govindaraja Nagar West Zone,P1771 Zone Works - POW Works,H Narsegowda,7899324448,,,000067,04-Mar-2016,,           ,,           ,,           ,Under Process in --,339207,Three Lakh Thirty Nine Thousand Two Hundred Seven,0,,0,
174,174,104-16-000010,26-Feb-2016,29-Jun-2016,Sinking of Borwell Providing Mini water tank and distrubution line at Thimenahalli in ward No. 104 Govindarajanagar,104 Govindaraja Nagar,Executive Engineer Govindaraja Nagar West Zone,P1802 Water Supply New Areas,R Paramesh,9611139622,,First and Final,000050,26-Feb-2016,000046,30-Jun-2016,000310,30-Jun-2016,004202,28-Jul-2017,000157 / 29-Jul-2017 in RTGS,493480,Four Lakh Ninety Three Thousand Four Hundred Eighty ,54836,Fifty Four Thousand Eight Hundred Thirty Six,438644,Four Lakh Thirty Eight Thousand Six Hundred Fourty Four
175,175,104-16-000011,26-Feb-2016,30-May-2016,Sinking of Borwell Providing Mini water tank and distrubution line at Govindarajangara in ward No. 104 Govindarajanagar,104 Govindaraja Nagar,Executive Engineer Govindaraja Nagar West Zone,P1802 Water Supply New Areas,R Paramesh,9611139622,,First and Final,000048,26-Feb-2016,000026,31-May-2016,000184,31-May-2016,004199,28-Jul-2017,000157 / 29-Jul-2017 in RTGS,483122,Four Lakh Eighty Three Thousand One Hundred Twenty Two,55436,Fifty Five Thousand Four Hundred Thirty Six,427686,Four Lakh Twenty Seven Thousand Six Hundred Eighty Six
176,176,104-16-000012,26-Feb-2016,30-May-2016,Sinking of Borwell Providing Mini water tank and distrubution line at Corporation Colony in ward No. 104 Govindarajanagar,104 Govindaraja Nagar,Executive Engineer Govindaraja Nagar West Zone,P1802 Water Supply New Areas,R Paramesh,9611139622,,First and Final,000049,26-Feb-2016,000027,31-May-2016,000183,31-May-2016,004198,28-Jul-2017,000157 / 29-Jul-2017 in RTGS,493532,Four Lakh Ninety Three Thousand Five Hundred Thirty Two,56592,Fifty Six Thousand Five Hundred Ninety Two,436940,Four Lakh Thirty Six Thousand Nine Hundred Fourty 
177,177,104-16-000019,24-Feb-2016,22-Aug-2016,Improvements to  prashanthivana  park in  ward no 104,104 Govindaraja Nagar,Executive Engineer SWM 1 Central Zone,P0088 Maintenance and Management of Parks on Contract,"Executive Engineer, KRIDL",9980709697,,First and Final,000008,24-Feb-2016,0.0013,22-Aug-2016,000437,14-Sep-2016,010329,07-Mar-2018,000422 / 15-Mar-2018 in RTGS,2845930,Twenty Eight Lakh Fourty Five Thousand Nine Hundred Thirty ,425544,Four Lakh Twenty Five Thousand Five Hundred Fourty Four,2420386,Twenty Four Lakh Twenty  Thousand Three Hundred Eighty Six
178,178,104-16-000020,24-Feb-2016,21-Aug-2016,Improvements to CHBS park in  ward no 104,104 Govindaraja Nagar,Executive Engineer Project West Zone,P0088 Maintenance and Management of Parks on Contract,The Executive Engineer 2	,9449863064,,First and Final,000005,24-Feb-2016,00012c,22-Aug-2016,000436,14-Sep-2016,009808,19-Feb-2018,000401 / 21-Feb-2018 in RTGS,2818870,Twenty Eight Lakh Eighteen Thousand Eight Hundred Seventy ,422864,Four Lakh Twenty Two Thousand Eight Hundred Sixty Four,2396006,Twenty Three Lakh Ninety Six Thousand Six
179,179,104-16-000017,24-Feb-2016,24-May-2016,Improvements to  kabaddi ground  park in  ward no 104,104 Govindaraja Nagar,Executive Engineer Project West Zone,P0088 Maintenance and Management of Parks on Contract,EE-2 KRIDL(WEST),9620222559,,First and Final,0000*4,24-Feb-2016,000002,26-May-2016,000130,31-May-2016,001019,02-May-2017,000042 / 05-May-2017 in RTGS,2924000,Twenty Nine Lakh Twenty Four Thousand ,455905,Four Lakh Fifty Five Thousand Nine Hundred Five,2468095,Twenty Four Lakh Sixty Eight Thousand Ninety Five
180,180,104-16-000018,24-Feb-2016,29-Apr-2016,Improvements to  maseedi  park in  ward no 104,104 Govindaraja Nagar,Executive Engineer Project West Zone,P0088 Maintenance and Management of Parks on Contract,EE-2 KRIDL(WEST) ,9663014735,,First and Final,*00006,24-Feb-2016,**0001,29-Apr-2016,000058,30-Apr-2016,007643,10-Nov-2017,000290 / 17-Nov-2017 in RTGS,2815855,Twenty Eight Lakh Fifteen Thousand Eight Hundred Fifty Five,411955,Four Lakh Eleven Thousand Nine Hundred Fifty Five,2403900,Twenty Four Lakh Three Thousand Nine Hundred 
181,181,104-15-000027,17-Apr-2015,28-Sep-2015,Providing flagging course and BS slab covering to drain at 1st main road (from Nagarabhavi road to 1st cross corporation colony) Prashantha nagara in ward no 104,104 Govindaraja Nagar,Executive Engineer Project West Zone,P3075 Special comprehensive development works in Bangalore city (Bangalore city in charge Minister Discretionary Grants),EE-2 KRIDL,9980228832,BBMP,First and Final,000004,17-Apr-2015,00027,28-Sep-2015,000395,09-Nov-2015,004567,05-Aug-2017,000174 / 08-Aug-2017 in RTGS,4759950,Fourty Seven Lakh Fifty Nine Thousand Nine Hundred Fifty ,723360,Seven Lakh Twenty Three Thousand Three Hundred Sixty ,4036590,Fourty  Lakh Thirty Six Thousand Five Hundred Ninety 
182,182,104-15-000029,17-Apr-2015,28-Sep-2015,Providing flagging course and BS slab covering to drain to Magadi main road 3rd cross at Prashanthanagara in ward no 104,104 Govindaraja Nagar,Executive Engineer Project West Zone,P3075 Special comprehensive development works in Bangalore city (Bangalore city in charge Minister Discretionary Grants),EE-2 KRIDL(WEST),8095016337,,First and Final,000006,17-Apr-2015,000026,28-Sep-2015,000394,09-Nov-2015,004565,05-Aug-2017,000174 / 08-Aug-2017 in RTGS,2336250,Twenty Three Lakh Thirty Six Thousand Two Hundred Fifty ,360435,Three Lakh Sixty  Thousand Four Hundred Thirty Five,1975815,Nineteen Lakh Seventy Five Thousand Eight Hundred Fifteen
183,183,104-14-000004,17-Apr-2015,29-May-2015,Reconstruction of culverts at 4th Main road at the junction of 10th cross road of MRCR Layout in Ward No 104,104 Govindaraja Nagar,Executive Engineer Govindaraja Nagar West Zone,P1771 Zone Works - POW Works,T R Shivakumar,9961998959,,First and Final,000027,17-Apr-2015,000067,30-May-2015,000192,30-May-2015,001367,08-May-2017,000052 / 10-May-2017 in RTGS,1250308,Twelve Lakh Fifty  Thousand Three Hundred Eight,163233,One Lakh Sixty Three Thousand Two Hundred Thirty Three,1087075,Ten Lakh Eighty Seven Thousand Seventy Five
184,184,104-14-000004,           ,           ,Reconstruction of culverts at 4th Main road at the junction of 10th cross road of MRCR Layout in Ward No 104,104 Govindaraja Nagar,Executive Engineer Govindaraja Nagar West Zone,P1771 Zone Works - POW Works,T R Shivakumar,9961998959,,,000027,17-Apr-2015,,           ,,           ,,           ,Under Process in --,1250308,Twelve Lakh Fifty  Thousand Three Hundred Eight,0,,0,
185,185,104-15-000007,15-Apr-2015,29-Apr-2016,Special Repairs to Anganwadi building at Corporation colony Govindarajangara in Ward No 104,104 Govindaraja Nagar,Executive Engineer Govindaraja Nagar West Zone,P1771 Zone Works - POW Works,R Lingappa and Sons Prop L Prasannakumar,9880576502,,Final,000016,15-Apr-2015,000003,30-Apr-2016,000076,30-Apr-2016,007656,10-Nov-2017,000290 / 17-Nov-2017 in RTGS,489864,Four Lakh Eighty Nine Thousand Eight Hundred Sixty Four,63723,Sixty Three Thousand Seven Hundred Twenty Three,426141,Four Lakh Twenty Six Thousand One Hundred Fourty One
186,186,104-15-000007,15-Apr-2015,19-Nov-2015,Providing MS grill to Anganwadi Building at Corporation colony Govindarajangara in Ward No 104,104 Govindaraja Nagar,Executive Engineer Govindaraja Nagar West Zone,P1771 Zone Works - POW Works,R Lingappa and Sons Prop L Prasanna Kumar,9880576502,,Running,000015,15-Apr-2015,000165,30-Nov-2015,000590,30-Nov-2015,004548,05-Aug-2017,000174 / 08-Aug-2017 in RTGS,522381,Five Lakh Twenty Two Thousand Three Hundred Eighty One,69769,Sixty Nine Thousand Seven Hundred Sixty Nine,452612,Four Lakh Fifty Two Thousand Six Hundred Twelve
187,187,104-15-000007,15-Apr-2015,30-May-2015,Special Repairs to IPP Hospital Building at 1st main road Prashanthanagara in Ward No 104,104 Govindaraja Nagar,Executive Engineer Govindaraja Nagar West Zone,P1771 Zone Works - POW Works,R Lingappa and Sons Prop L Prasanna Kumar,9880576502,,Running,000013,15-Apr-2015,000068,30-May-2015,000191,30-May-2015,002738,08-Jun-2017,000100 / 14-Jun-2017 in RTGS,204334,Two Lakh Four Thousand Three Hundred Thirty Four,25974,Twenty Five Thousand Nine Hundred Seventy Four,178360,One Lakh Seventy Eight Thousand Three Hundred Sixty 
188,188,104-15-000007,15-Apr-2015,19-Nov-2015,Providing Gazebo and Improvements to Purandara Park at CHBS Layout in Ward No 104,104 Govindaraja Nagar,Executive Engineer Govindaraja Nagar West Zone,P1771 Zone Works - POW Works,R Lingappa & sons Prop L Prasanna Kumar,9880576502,,Running,000014,15-Apr-2015,000166,30-Nov-2015,000589,30-May-2015,001727,18-May-2017,000066 / 23-May-2017 in RTGS,507680,Five Lakh Seven Thousand Six Hundred Eighty ,67950,Sixty Seven Thousand Nine Hundred Fifty ,439730,Four Lakh Thirty Nine Thousand Seven Hundred Thirty 
189,189,104-15-000007,           ,           ,Special Repairs to IPP Hospital Building at 1st main road Prashanthanagara in Ward No 104,104 Govindaraja Nagar,Executive Engineer Govindaraja Nagar West Zone,P1771 Zone Works - POW Works,R Lingappa and Sons Prop L Prasanna Kumar,9880576502,,,000013,15-Apr-2015,,           ,,           ,,           ,Under Process in --,204334,Two Lakh Four Thousand Three Hundred Thirty Four,0,,0,
190,190,104-15-000007,           ,           ,Providing Gazebo and Improvements to Purandara Park at CHBS Layout in Ward No 104,104 Govindaraja Nagar,Executive Engineer Govindaraja Nagar West Zone,P1771 Zone Works - POW Works,R Lingappa & sons Prop L Prasanna Kumar,9880576502,,,000014,15-Apr-2015,,           ,,           ,,           ,Under Process in --,507680,Five Lakh Seven Thousand Six Hundred Eighty ,0,,0,
191,191,104-15-000025,20-Feb-2015,31-May-2017, Providing Arch to Sri Prashantha Ganapathi temple at the junction of 8th cross in 1st main road Prashanthanagara ward no 104  ,104 Govindaraja Nagar,Executive Engineer Govindaraja Nagar West Zone,P2415 Reserve fund for TandF Committee,Technical Manager west KRIDL,9900000000,,Running,000291,20-Feb-2015,000030,25-May-2017,000097,31-May-2017,010070,28-Mar-2019,000390 / 28-Mar-2019 in RTGS,937585,Nine Lakh Thirty Seven Thousand Five Hundred Eighty Five,128116,One Lakh Twenty Eight Thousand One Hundred Sixteen,809469,Eight Lakh Nine Thousand Four Hundred Sixty Nine
192,192,104-15-000001,20-Feb-2015,29-Apr-2016,Providing asphalting to main and cross roads of CHBS Layout in ward no 104,104 Govindaraja Nagar,Executive Engineer Govindaraja Nagar West Zone,P0190 Works sanctioned by Hon Mayor,Technical Manager West KRIDL,9900000000,,First and Final,00o323,20-Feb-2015,000011,29-Apr-2016,000078,30-Apr-2016,000793,30-Apr-2018,000032 / 03-May-2018 in RTGS,5464609,Fifty Four Lakh Sixty Four Thousand Six Hundred Nine,763758,Seven Lakh Sixty Three Thousand Seven Hundred Fifty Eight,4700851,Fourty Seven Lakh Eight Hundred Fifty One
193,193,104-15-000002,20-Feb-2015,28-Apr-2016,Asphalting to main and cross roads govindarajanagra in ward no 104,104 Govindaraja Nagar,Executive Engineer Govindaraja Nagar West Zone,P0190 Works sanctioned by Hon Mayor,Technical Manager West KRIDL,9900000000,,First and Final,00o322,20-Feb-2015,000012,30-Apr-2016,000079,30-Apr-2016,000794,30-Apr-2018,000032 / 03-May-2018 in RTGS,5456579,Fifty Four Lakh Fifty Six Thousand Five Hundred Seventy Nine,762674,Seven Lakh Sixty Two Thousand Six Hundred Seventy Four,4693905,Fourty Six Lakh Ninety Three Thousand Nine Hundred Five
194,194,104-15-000005,20-Feb-2015,20-Jul-2015,Providing Asphalting to 23rd 24th cross and sub cross roads corporation colony Govindarajanagra in ward no 104,104 Govindaraja Nagar,A O Project (Accounts) Central Zone,P0190 Works sanctioned by Hon Mayor,"Technical Manager-II, KRIDL",9845222227,,First and Final,000320,20-Feb-2015,000143,20-Jul-2015,205/15-16,24-Jul-2015,002636,06-Jun-2017,000090 / 07-Jun-2017 in RTGS,5318019,Fifty Three Lakh Eighteen Thousand Nineteen,394098,Three Lakh Ninety Four Thousand Ninety Eight,4923921,Fourty Nine Lakh Twenty Three Thousand Nine Hundred Twenty One
195,195,104-15-000006,20-Feb-2015,24-Jul-2015,Asphalting to 22nd cross road Govindarajanagra in ward no 104,104 Govindaraja Nagar,A O Project (Accounts) Central Zone,P0190 Works sanctioned by Hon Mayor,"Technical Manager-II, KRIDL",9845222227,,First and Final,000321,20-Feb-2015,000144,20-Jul-2015,204/15-16,24-Jul-2015,002629,05-Jun-2017,000090 / 07-Jun-2017 in RTGS,5408023,Fifty Four Lakh Eight Thousand Twenty Three,398969,Three Lakh Ninety Eight Thousand Nine Hundred Sixty Nine,5009054,Fifty  Lakh Nine Thousand Fifty Four
196,196,104-14-000004,20-Feb-2015,22-Apr-2015,Reconstruction of culverts at 5th main road at the junction of 14th cross road MRCR Layout in Ward no 104,104 Govindaraja Nagar,Executive Engineer Govindaraja Nagar West Zone,P1771 Zone Works - POW Works,Sharth Gowda B,8095016337,,Running,000280,20-Feb-2015,000014,23-Apr-2015,000038,23-Apr-2015,000401,19-Apr-2017,000025 / 21-Apr-2017 in RTGS,202620,Two Lakh Two Thousand Six Hundred Twenty ,24188,Twenty Four Thousand One Hundred Eighty Eight,178432,One Lakh Seventy Eight Thousand Four Hundred Thirty Two
197,197,104-14-000004,20-Feb-2015,22-Apr-2015,Reconstruction of culverts at 5th main road at the junction of 16th cross road MRCR layout in Ward No 104,104 Govindaraja Nagar,Executive Engineer Govindaraja Nagar West Zone,P1771 Zone Works - POW Works,Sharth Gowda B,8095016337,,Running,000283,20-Feb-2015,000013,23-Apr-2015,000040,23-Apr-2015,000400,19-Apr-2017,000025 / 21-Apr-2017 in RTGS,197916,One Lakh Ninety Seven Thousand Nine Hundred Sixteen,23274,Twenty Three Thousand Two Hundred Seventy Four,174642,One Lakh Seventy Four Thousand Six Hundred Fourty Two
198,198,104-14-000004,20-Feb-2015,23-Apr-2015,Construction of Lead off drains at 16th cross road MRCR Layout in Ward No 104,104 Govindaraja Nagar,Executive Engineer Govindaraja Nagar West Zone,P1771 Zone Works - POW Works,Sharth Gowda B,8095016337,,Running,000282,20-Feb-2015,000012,23-Apr-2015,000039,23-Apr-2015,000399,19-Apr-2017,000025 / 21-Apr-2017 in RTGS,209378,Two Lakh Nine Thousand Three Hundred Seventy Eight,24197,Twenty Four Thousand One Hundred Ninety Seven,185181,One Lakh Eighty Five Thousand One Hundred Eighty One
199,199,104-14-000004,20-Feb-2015,23-Apr-2015,Construction of Lead off Drains at 14th cross road MRCR Layout in Ward No 104,104 Govindaraja Nagar,Executive Engineer Govindaraja Nagar West Zone,P1771 Zone Works - POW Works,Sharth gowda B,8095016337,,Running,000281,20-Feb-2015,000011,23-Apr-2015,000041,23-Apr-2015,000398,19-Apr-2017,000025 / 21-Apr-2017 in RTGS,208939,Two Lakh Eight Thousand Nine Hundred Thirty Nine,24487,Twenty Four Thousand Four Hundred Eighty Seven,184452,One Lakh Eighty Four Thousand Four Hundred Fifty Two
200,200,104-15-000024,20-Feb-2015,16-Apr-2015,Developmental works in Bulleward in between 8th cross and 17th cross MRCR Layout ward no 104  ,104 Govindaraja Nagar,Executive Engineer Govindaraja Nagar West Zone,P2415 Reserve fund for TandF Committee,Technical manager West KRIDL,9900000000,,First and Final,000290,20-Feb-2015,000005,23-Apr-2015,000031,23-Apr-2015,000507,19-Apr-2017,000025 / 21-Apr-2017 in RTGS,1621801,Sixteen Lakh Twenty One Thousand Eight Hundred One,219773,Two Lakh Nineteen Thousand Seven Hundred Seventy Three,1402028,Fourteen Lakh Two Thousand Twenty Eight
